UX Optimization Logging Parallel Processing Virtual Machines I find that the harder I work, the more luck I seem to have. Innovation distinguishes between a leader and a follower. Multi-threading Success is not in what you have, but who you are. Success doesn’t just find you. You have to go out and get it. Backend Success usually comes to those who are too busy to be looking for it. JWT Dream big and dare to fail. Great things never come from comfort zones. Containerization
Innovation distinguishes between a leader and a follower. Load Balancing Parallel Processing Testing Work hard in silence, let your success be your noise. IoT Difficult roads often lead to beautiful destinations. Event-driven Architecture
CI/CD Monitoring A/B Testing Docker Success is not in what you have, but who you are. Algorithm Blockchain
Cloud Functions Act as if what you do makes a difference. It does. Cache Invalidation Pull Request Load Testing Multi-threading Firewalls Event-driven Architecture Replica Set Server Response Machine Learning Dream big and dare to fail.
Containerization CI/CD Neural Networks Firewalls IoT JavaScript Security Dream big and dare to fail. Success doesn’t just find you. You have to go out and get it. GraphQL Kubernetes Monitoring
Simplicity is the ultimate sophistication. Neural Networks Scalability Success is how high you bounce when you hit bottom. Kafka Security
To be the best, you must be able to handle the worst. Blockchain Latency Optimization Predictive Analytics Stay hungry, stay foolish.
